[
  {
    "id": "grintser-1-2",
    "type": "translation",
    "author": "П. А. Гринцер",
    "title": "Рамаяна. Книги I–II: Балаканда (Книга о детстве), Айодхьяканда (Книга об Айодхье)",
    "year": "2006",
    "source_language": "санскрит",
    "coverage": "Книги I–II",
    "edition": "Ладомир : Наука",
    "series": "Литературные памятники",
    "url": "https://samskrtam.ru/parallel-corpus/index_ramayana.html",
    "status": "published"
  },
  {
    "id": "grintser-3",
    "type": "translation",
    "author": "П. А. Гринцер",
    "title": "Рамаяна. Книга III: Араньяканда (Книга о лесе)",
    "year": "2014",
    "source_language": "санскрит",
    "coverage": "Книга III",
    "edition": "Ладомир : Наука",
    "series": "Литературные памятники",
    "url": "https://samskrtam.ru/parallel-corpus/03_ramayana-aranyakanda.html",
    "status": "published"
  },
  {
    "id": "serebryany-4",
    "type": "translation",
    "author": "С. Д. Серебряный",
    "title": "Рамаяна. Книга IV: Кишкиндха-канда (Книга о Кишкиндхе)",
    "year": "готовится",
    "source_language": "санскрит",
    "coverage": "Книга IV",
    "edition": "Ладомир : Наука",
    "series": "Литературные памятники",
    "status": "blocked"
  },
  {
    "id": "leonov-5",
    "type": "translation",
    "author": "М. В. Леонов",
    "title": "Рамаяна. Книга V: Сундара-канда (Прекрасная книга)",
    "year": "ожидается ~2027",
    "source_language": "санскрит",
    "coverage": "Книга V",
    "series": "Литературные памятники",
    "status": "in-progress"
  },
  {
    "id": "leonov-6",
    "type": "translation",
    "author": "М. В. Леонов",
    "title": "Рамаяна. Книга VI: Юддха-канда (Книга о битве)",
    "year": "ожидается ~2029",
    "source_language": "санскрит",
    "coverage": "Книга VI",
    "series": "Литературные памятники",
    "status": "draft-ready"
  },
  {
    "id": "potapova",
    "type": "poetic",
    "author": "В. А. Потапова",
    "title": "Рамаяна (поэтический перевод)",
    "year": "1986",
    "source_language": "санскрит (через подстрочник Б. А. Захарьина)",
    "coverage": "Избранные эпизоды всех книг (~6000 строк из ~48000)",
    "edition": "Художественная литература",
    "url": "https://samskrtam.ru/parallel-corpus/ramayana-potapovoy.html",
    "status": "published"
  }
]
